{
  "$schema": "http://json-schema.org/draft-07/schema#",
  "$id": "https://namma-bengaluru/schema/project.schema.json",
  "title": "project",
  "description": "Spec §3.1. One project record per stable slug id.",
  "type": "object",
  "additionalProperties": false,
  "required": [
    "id",
    "name",
    "agency",
    "category",
    "scope",
    "status",
    "wards",
    "corporation",
    "confidence",
    "verified_on"
  ],
  "properties": {
    "id": {
      "type": "string",
      "description": "Stable, human-readable slug, e.g. metro-phase-2",
      "pattern": "^[a-z0-9]+(-[a-z0-9]+)*$"
    },
    "name": { "type": "string", "description": "As the agency calls it" },
    "aka": {
      "type": "array",
      "items": { "type": "string" },
      "description": "Alternate names for search"
    },
    "agency": {
      "enum": ["BMRCL", "BMTC", "BDA", "BWSSB", "K-RIDE", "B-SMILE", "GBA", "corporation", "other"]
    },
    "category": {
      "enum": ["metro_rail", "roads", "buses", "water_sewerage", "drains_lakes", "parks_public"]
    },
    "scope": { "type": "string", "description": "e.g. \"75.09 km, 4 extensions, 2 new lines\"" },
    "status": {
      "enum": [
        "announced",
        "sanctioned",
        "tendering",
        "awarded",
        "under_construction",
        "partially_open",
        "complete",
        "stalled",
        "cancelled"
      ]
    },
    "sanction_date": { "type": ["string", "null"], "format": "date" },
    "original_deadline": { "type": ["string", "null"], "format": "date" },
    "current_deadline": { "type": ["string", "null"], "format": "date" },
    "pending": { "type": "string", "description": "What is blocking it, factually stated" },
    "geometry": {
      "description": "Deprecated: must be null or absent. Geometry lives in data/geometry/<project-id>.geojson so project diffs stay readable (docs/plans/02).",
      "oneOf": [
        { "type": "null" },
        {
          "type": "object",
          "required": ["type", "coordinates"],
          "properties": {
            "type": { "enum": ["Point", "LineString", "Polygon"] },
            "coordinates": {}
          }
        }
      ]
    },
    "geometry_basis": {
      "enum": ["surveyed", "osm", "approximate", "unknown"],
      "description": "Where the geometry came from. approximate = a point or line standing in for an unknown alignment; the map must say so (spec §5.1)"
    },
    "wards": {
      "type": "array",
      "items": {
        "type": "string",
        "pattern": "^(gba2025:[1-5]-[0-9]+|bbmp243:[0-9]+|bbmp198:[0-9]+)$"
      },
      "description": "Scheme-prefixed ward codes the project touches: gba2025:<corporation_id>-<ward_no> (corporation ids 1-5 = Central/North/East/South/West), bbmp243:<ward_no>, bbmp198:<ward_no>. See docs/plans/02-geometry-and-wards.md"
    },
    "ward_basis": {
      "type": "string",
      "description": "How the wards list was derived, e.g. \"alignment passes within 40 m of the ward\""
    },
    "corporation": {
      "enum": ["Central", "East", "North", "South", "West", "outside_GBA", "BBMP"],
      "description": "GBA corporation, outside_GBA, or BBMP for records that predate the 2025 GBA restructuring. For projects spanning several corporations this is the one with the largest share; see corporations."
    },
    "corporations": {
      "type": "array",
      "items": { "enum": ["Central", "East", "North", "South", "West"] },
      "description": "Every GBA corporation the project touches, when there is more than one. Set by scripts/assign-wards.mjs."
    },
    "confidence": { "enum": ["high", "medium", "low"] },
    "verified_on": {
      "type": "string",
      "format": "date",
      "description": "Last date a human checked this record"
    },
    "notes": { "type": "string", "description": "Caveats, conflicting figures" }
  }
}
