{
  "id": "alpine-eco-road-grade-separator",
  "name": "Alpine Eco Road grade separator",
  "agency": "corporation",
  "category": "roads",
  "scope": "Grade separator at Alpine Eco Road on the Outer Ring Road, East Bengaluru",
  "status": "announced",
  "pending": "Budget line item only as of the 2026-27 corporation budget — no tender or construction start located yet.",
  "wards": [],
  "corporation": "East",
  "confidence": "medium",
  "verified_on": "2026-09-20",
  "notes": "Same 2026-27 Bengaluru East City Corporation budget round as varthur-gunjur-flyover."
}
