{
  "id": "varthur-gunjur-flyover",
  "name": "Varthur–Gunjur elevated flyover",
  "agency": "corporation",
  "category": "roads",
  "scope": "2 km elevated flyover on the Varthur–Gunjur stretch, intended to address one of the area's worst traffic bottlenecks",
  "status": "announced",
  "pending": "Budget line item only as of the 2026-27 corporation budget — no tender or construction start located yet.",
  "wards": [],
  "corporation": "East",
  "confidence": "medium",
  "verified_on": "2026-09-20",
  "notes": "First record on this site attributed to one of the five GBA city corporations directly (agency: corporation) rather than BBMP/GBA as a whole, reflecting the 2024-25 restructuring."
}
