{
  "id": "green-line-ext-silk-institute",
  "name": "Green Line extension: Yelachenahalli – Silk Institute",
  "aka": ["Green Line Anjanapura extension"],
  "agency": "BMRCL",
  "category": "metro_rail",
  "scope": "6.29 km southern extension of the Green Line, part of Namma Metro Phase 2",
  "status": "complete",
  "wards": [],
  "corporation": "South",
  "confidence": "medium",
  "verified_on": "2026-09-19",
  "notes": "Inaugurated 2021-01-14, per The Metro Rail Guy. No money_entry recorded yet — a specific cost figure for this corridor has not been located in a citable source."
}
